{
  "meta": {
    "title": "中国宏观月报",
    "period": "2026年9月",
    "data_cutoff": "PMI为9月数据（9/30发布）；CPI/PPI、社融/M2、进出口、工业增加值、社零为8月数据；LPR为9/20报价；DR007为9月末数据；工业企业利润/存货为8月数据；国债收益率截至9/29",
    "generated_at": "2026-10-02",
    "search_count": 19,
    "completeness": {"present": 17, "total": 19},
    "missing": ["工业企业产成品存货历史分位（缺乏统一的库存周期分位基准数据）", "百城住宅价格指数最新月度值（未检索到2026年8月/9月发布值）"],
    "hero_quote": "制造业景气面扩大，价格全面回暖，但内需偏弱与库存偏高构成不对称修复"
  },

  "indicators": [
    {
      "name": "官方制造业PMI",
      "period": "9月",
      "published": "50.1",
      "expected": null,
      "previous": "49.8",
      "direction": "up",
      "direction_text": "▲ +0.3",
      "label": "lead"
    },
    {
      "name": "官方制造业PMI·新订单",
      "period": "9月",
      "published": "50.5",
      "expected": null,
      "previous": "50.6",
      "direction": "down",
      "direction_text": "▼ -0.1",
      "label": "lead"
    },
    {
      "name": "官方制造业PMI·生产",
      "period": "9月",
      "published": "51.7",
      "expected": null,
      "previous": "50.4",
      "direction": "up",
      "direction_text": "▲ +1.3",
      "label": "coin"
    },
    {
      "name": "官方制造业PMI·原材料库存",
      "period": "9月",
      "published": "48.0",
      "expected": null,
      "previous": "48.0",
      "direction": "flat",
      "direction_text": "— 持平",
      "label": "lead"
    },
    {
      "name": "RatingDog/财新制造业PMI",
      "period": "9月",
      "published": "52.1",
      "expected": "51.7",
      "previous": "51.5",
      "direction": "up",
      "direction_text": "▲ +0.6",
      "label": "lead"
    },
    {
      "name": "CPI同比",
      "period": "8月",
      "published": "0.8%",
      "expected": null,
      "previous": "0.5%",
      "direction": "up",
      "direction_text": "▲ +0.3pct",
      "label": "lag"
    },
    {
      "name": "核心CPI同比",
      "period": "8月",
      "published": "1.2%",
      "expected": null,
      "previous": "0.9%",
      "direction": "up",
      "direction_text": "▲ +0.3pct",
      "label": "lag"
    },
    {
      "name": "PPI同比",
      "period": "8月",
      "published": "3.8%",
      "expected": null,
      "previous": "3.5%",
      "direction": "up",
      "direction_text": "▲ +0.3pct",
      "label": "lag"
    },
    {
      "name": "社融存量同比",
      "period": "8月",
      "published": "7.2%",
      "expected": null,
      "previous": "7.3%",
      "direction": "down",
      "direction_text": "▼ -0.1pct",
      "label": "lead"
    },
    {
      "name": "M2同比",
      "period": "8月",
      "published": "7.5%",
      "expected": null,
      "previous": "7.5%",
      "direction": "flat",
      "direction_text": "— 持平",
      "label": "lead"
    },
    {
      "name": "M1同比",
      "period": "8月",
      "published": "4.1%",
      "expected": null,
      "previous": "3.8%",
      "direction": "up",
      "direction_text": "▲ +0.3pct",
      "label": "lead"
    },
    {
      "name": "1年期LPR",
      "period": "9月",
      "published": "3.0%",
      "expected": "3.0%",
      "previous": "3.0%",
      "direction": "flat",
      "direction_text": "— 连续16月不变",
      "label": "lag"
    },
    {
      "name": "5年期以上LPR",
      "period": "9月",
      "published": "3.5%",
      "expected": "3.5%",
      "previous": "3.5%",
      "direction": "flat",
      "direction_text": "— 连续16月不变",
      "label": "lag"
    },
    {
      "name": "DR007（月末加权）",
      "period": "9月末",
      "published": "约1.39%",
      "expected": null,
      "previous": "约1.44%",
      "direction": "down",
      "direction_text": "▼ 约-5bp",
      "label": "coin"
    },
    {
      "name": "工业增加值同比",
      "period": "8月",
      "published": "5.2%",
      "expected": "4.7%",
      "previous": "4.5%",
      "direction": "up",
      "direction_text": "▲ +0.7pct",
      "label": "coin"
    },
    {
      "name": "社会消费品零售总额同比",
      "period": "8月",
      "published": "0.4%",
      "expected": "0.7%",
      "previous": "0.6%",
      "direction": "down",
      "direction_text": "▼ -0.2pct",
      "label": "coin"
    },
    {
      "name": "出口同比（美元计）",
      "period": "8月",
      "published": "25.0%",
      "expected": "25.0%",
      "previous": "23.9%",
      "direction": "up",
      "direction_text": "▲ +1.1pct",
      "label": "coin"
    },
    {
      "name": "工业企业产成品存货同比",
      "period": "8月",
      "published": "11.0%",
      "expected": null,
      "previous": "10.8%",
      "direction": "up",
      "direction_text": "▲ +0.2pct",
      "label": "lag"
    },
    {
      "name": "人民币兑美元中间价",
      "period": "9月末",
      "published": "6.7351",
      "expected": null,
      "previous": "约6.7489（9/26）",
      "direction": "up",
      "direction_text": "▲ 人民币升值约138点",
      "label": "coin"
    }
  ],

  "signals": {
    "leading": "PMI新订单50.5（仍扩张但微降0.1），生产51.7大幅回升1.3，新订单-生产剪刀差收窄至-1.2，指向生产端在出口和补库需求驱动下加速，但需求端扩张力度边际趋缓。社融存量同比7.2%（前值7.3%），政府债券高基数拖累显现（政府债券净融资同比少1.5万亿），市场化社融中企业债券净融资同比多1.23万亿形成部分对冲。M1同比回升至4.1%（前值3.8%），企业活期存款边际改善，是信用活化度的积极信号。收益率曲线短端稳定、长端下行至1.67%，曲线小幅走陡，但属于流动性宽松驱动的牛陡而非增长预期改善。综合领先组信号：经济处于弱修复通道，但内需自发回暖的证据尚不充分。",
    "coincident": "工业增加值8月同比5.2%显著超预期（预期4.7%），环比加快0.7pct，上游能化链补库和出口交货值回升是主驱动。但社零同比仅0.4%、低于预期0.7%，且连续两个月回落，内需与外需形成极端分化——出口同比25.0%维持高景气，消费增速却逼近零增长。固定资产投资1-8月同比-7.2%，跌幅较1-7月扩大0.5pct，基建投资边际企稳但弹性有限。同步组呈现“外需强、内需弱、生产升、消费滞”的K型格局。",
    "lagging": "CPI同比0.8%（前值0.5%）、核心CPI 1.2%（前值0.9%）、PPI同比3.8%（前值3.5%），三项价格指标同步回暖，但驱动力以输入性能源价格（能源价格涨幅从0.6%扩至4.1%）和国际大宗商品传导为主，需求拉动力度有限。工业企业产成品存货同比升至11.0%，连续刷新2023年3月以来新高，且与营收增速（累计6.6%）的缺口继续走阔，库存压力仍在累积。滞后组的“价格回暖”不宜解读为需求驱动型通胀，“库存高企”则是需要警惕的负面信号。",
    "consistency": "领先组与同步组方向基本一致（生产端扩张得到工业增加值数据确认），但内需端存在显著背离：社融存量同比小幅回落、社零逼近零增长，与PMI重返扩张区间和出口高景气形成张力。以领先组为前瞻线索判断，经济修复的结构性特征为“外需和上游驱动、内需和下游滞后”。库存周期方面，PMI原材料库存分项持平于48.0（收缩区间）与工业企业产成品存货同比11.0%（高位继续上行）方向不一致——企业主动补原材料意愿不足，但产成品被动积压，提示可能处于被动补库向主动去库过渡的敏感窗口。"
  },

  "rate_cascade": {
    "source": {"text": "7天期逆回购操作利率维持1.40%不变，9月末央行以1.40%中标利率开展905亿元7天期逆回购操作，并额外开展6985亿元隔夜逆回购（每日操作量上限1万亿元），跨季流动性呵护意图明确。政策利率自上次调整以来连续持稳，源头层‘通’。", "status": "ok"},
    "wholesale": {"text": "DR007月末加权平均利率约1.39%，较前一周下行约5bp；9月28日DR007报1.3911%。资金面整体宽松，跨季压力被央行隔夜逆回购工具有效对冲。批发价层‘通’，资金从银行间向实体传导不存在银行间流动性梗阻。", "status": "ok"},
    "retail": {"text": "9月LPR 1Y=3.0%、5Y=3.5%，连续16个月不变。新发放企业贷款加权平均利率低于3.0%，个人住房贷款利率约3.1%，均处历史低位。实体融资成本已低，但LPR进一步下调受制于商业银行净息差（二季度末1.41%，历史低位）和美联储加息后中美利差极度走阔的外部约束。实体价层‘等待’——利率已足够低，核心矛盾在于融资需求而非价格。", "status": "wait"},
    "dr007_policy_spread": -1.0,
    "ncd_rate": 1.48,
    "diagnosis": "三层瀑布逐层通/通/等。断流点不在银行间流动性，而在实体需求端。证据：① DR007与政策利率利差-1bp（偏松）；② 同业存单1Y发行利率1.48%处于历史极低位（银行负债成本极低）；③ 但前八个月住户贷款减少1.03万亿元、其中中长期贷款仅增加188亿元——居民端信贷需求极度疲弱是核心堵点。利率传导链条完整但终点乏力的根因是资产负债表衰退特征：低利率无法激发私人部门加杠杆意愿。"
  },

  "fx": {
    "what_moves": "人民币兑美元中间价9月28日报6.7399，创2023年2月以来逾三年半新高，较前一交易日上调90点。但同期美元指数DXY升至101.61（10月1日），为2026年6月以来最高。人民币对美元升值与美元走强同时发生，说明动的主要是人民币自身的强势因素，而非美元走弱——CFETS篮子指数的稳定进一步印证了这一点。",
    "why_moves": "尽管中美10Y国债利差已走阔至创纪录的327bp（中国1.68% vs 美国4.95%），按传统利差模型人民币应承压，但实际走势相反，说明利差当前并非人民币汇率的主导变量。主导力量是贸易顺差持续高增（1-8月顺差8055.1亿美元）带来的结汇需求，以及出口商在出口增速连续三个月20%+背景下集中结汇的季节性行为。美元指数虽升至101.61，但人民币凭借强劲的贸易项下外汇供给实现了对美元的逆势升值。",
    "transmission": "出口链：人民币升值边际削弱出口价格竞争力，但当前出口高增主要由海外补库需求和AI链驱动，价格弹性有限，短期影响可控。进口链：升值降低进口成本，对能源和大宗商品进口企业有利。外债主体：以美元计价的外债偿债成本降低。资本项：中美利差327bp的极端倒挂理论上应施压资本外流，但实际外汇储备稳定在3.4万亿美元以上，说明贸易顺差和结汇意愿构成了有效的资本流出缓冲垫。",
    "calibration": "人民币升值是贸易竞争力的自然结果，不是货币政策目标。在当前内需偏弱的背景下，人民币适度偏强有助于降低输入性通胀压力和进口成本。但若升值过快，需关注出口部门利润和就业的滞后影响。中美利差327bp的极端水平意味着，一旦贸易顺差收窄，汇率将面临利差驱动的回调压力，这是需要纳入风险监测的中期变量。",
    "us_cn_10y_spread": -327,
    "dxy": 101.61
  },

  "cross_validation": {
    "rows": [
      {
        "original": "工业增加值8月同比5.2%（超预期4.7%）",
        "evidence1": "全社会用电量8月同比+1.7%（前值+4.3%），增速较上月显著放缓",
        "evidence2": "1-8月全国税收收入同比+6.6%，国内增值税同比+5.9%，均保持增长",
        "fit": "部分咬合，存在方向性偏差。用电量增速放缓与工业增加值加速形成背离，偏差方向为用电量偏低。可能解释：高耗能行业（如黑色金属）生产仍低于临界点，用电增量主要来自高技术制造业和装备制造业，单位增加值电耗较低；或工业增加值中价格因素（PPI回升）贡献了名义增量。税收增长方向与工业增加值一致，但增值税增速（5.9%）低于工增（5.2%）的差值在合理范围内。",
        "fit_class": "up"
      },
      {
        "original": "出口8月同比25.0%（美元计）",
        "evidence1": "海关总署出口交货值同比+11.1%（8月），方向一致",
        "evidence2": "1-8月出口累计同比+19.3%，与单月增速匹配",
        "fit": "咬合。出口交货值（生产端指标）与出口金额（贸易端指标）方向一致，均指向外需强劲。出口增速连续三个月20%+且逐月走高，与全球制造业PMI回升和美国补库周期形成交叉印证。",
        "fit_class": "up"
      }
    ],
    "conclusion": "软硬对照总体咬合，但存在两个值得关注的偏差：① 用电量增速（1.7%）与工业增加值增速（5.2%）的缺口达3.5pct，若排除产业结构电耗差异，提示工业增加值的实际改善幅度可能被高估，或用电量数据受去年高基数（2025年8月用电量超万亿）压制；② 税收增速（6.6%）高于名义GDP隐含增速，反映财政收入改善可能部分来自征管加强而非经济活动的全面回暖。偏差量级在可控范围内，不改变经济弱修复的方向判断，但提示改善的广度和持续性有待后续数据确认。"
  },

  "cycle_gauge": {
    "dimensions": [
      {"name": "估值分位", "meta": "沪深300 PE约13.3倍，处于2008年以来61%分位，近十年61.8%分位。PB为1.4倍，仅处2008年以来24%分位。PE偏高但PB偏低，反映盈利能力（ROE）尚在低位。", "extreme": false, "fill": 61, "hot": false, "percentile": 61, "baseline": "2008年以来沪深300 PE（TTM）历史分位"},
      {"name": "信贷（社融 + 利差）", "meta": "社融存量同比7.2%仍处下行通道；DR007与政策利率利差-1bp极宽松；但住户贷款前八月净减少1.03万亿，信贷结构极度失衡。综合评定为偏宽松但传导受阻。", "extreme": true, "fill": 15, "hot": true, "percentile": 15, "baseline": "2015年以来社融存量同比增速历史分位（当前处于约15%分位，接近历史低位区间）"},
      {"name": "情绪（融资余额 / 新开户）", "meta": "缺乏直接的最新融资余额和新开户数据，从沪深300 PE处于历史中位偏上及近期市场走势推断，情绪指标处于中性区间，未出现极端亢奋或恐慌。", "extreme": false, "fill": 50, "hot": false, "percentile": 50, "baseline": "沪深300 PE分位作为情绪代理指标，2008年以来基准"},
      {"name": "本轮运行时长", "meta": "2026年Q1 GDP同比5.0%为阶段性高点，Q2回落至4.3%，当前处于增速下探后的政策观察期，本轮下行已持续约两个季度。若以2025年Q2的5.2%为本轮高点计，已运行约五个季度。", "extreme": false, "fill": 40, "hot": false, "percentile": 40, "baseline": "2010年以来中国经济短周期下行阶段平均持续时间约6-8个季度作为100%基准"}
    ],
    "verdict": "1/4项极端（信贷维度），远未达到≥3项极端且同向的行动触发阈值。信贷维度的极端宽松（DR007利差-1bp、NCD历史低位）与实体融资需求的极度疲弱（住户贷款净减少）并存，构成‘宽货币、紧信用’的典型组合。",
    "conclusion": "中性",
    "note": "当前宏观图景的核心矛盾是结构性而非总量性的：政策端流动性极度充裕、价格端全面回暖、外需端高度景气，但内需端（消费、地产、居民信贷）持续偏弱。这种‘外部热、内部冷’的K型分化使得总量层面的周期定位信号不足，应维持中性配置，重点跟踪内需边际变化和政策传导效果，而非基于单一维度做方向性押注。"
  },

  "inventory_cycle": {
    "stage": "被动补库",
    "pmi_raw_inventory": 48.0,
    "pmi_finished_inventory": 48.5,
    "industrial_inventory_yoy": 11.0,
    "percentile": null
  },

  "cpi_ppi": {
    "ppi_yoy": 3.8,
    "cpi_yoy": 0.8,
    "core_cpi_yoy": 1.2,
    "scissors": 3.0,